{
  "schema_version": "ISRAS-TOOL-BOOTSTRAP-LOCK-V1",
  "created_at": "2026-07-16T00:00:00Z",
  "platform": {
    "system": "Linux",
    "machine": "x86_64",
    "python_implementation": "CPython",
    "python_abi": "cpython-example"
  },
  "python": "3.14.6",
  "python_executable_sha512": "11111111111111111111111111111111111111111111111111111111111111111111111111111111111111111111111111111111111111111111111111111111",
  "requirements_source_sha512": "22222222222222222222222222222222222222222222222222222222222222222222222222222222222222222222222222222222222222222222222222222222",
  "resolver_pip_version": "25.1.1",
  "pip_wheel": {
    "name": "pip",
    "version": "25.1.1",
    "filename": "pip-25.1.1-py3-none-any.whl",
    "sha512": "33333333333333333333333333333333333333333333333333333333333333333333333333333333333333333333333333333333333333333333333333333333",
    "source_url": "https://files.pythonhosted.org/example/pip-25.1.1-py3-none-any.whl",
    "source_hashes": {
      "sha256": "4444444444444444444444444444444444444444444444444444444444444444"
    }
  },
  "requirements_lock_sha512": "55555555555555555555555555555555555555555555555555555555555555555555555555555555555555555555555555555555555555555555555555555555",
  "artifacts": [
    {
      "name": "example",
      "version": "1.0.0",
      "filename": "example-1.0.0-py3-none-any.whl",
      "sha512": "66666666666666666666666666666666666666666666666666666666666666666666666666666666666666666666666666666666666666666666666666666666",
      "source_url": "https://files.pythonhosted.org/example/example-1.0.0-py3-none-any.whl",
      "source_hashes": {
        "sha256": "7777777777777777777777777777777777777777777777777777777777777777"
      }
    }
  ]
}
